{
  "$schema": "https://json-schema.org/draft/2020-12/schema",
  "$id": "https://garden.omni.dev/garden.schema.json",
  "title": "garden.json",
  "description": "Ecosystem specification as a composable directed graph",
  "type": "object",
  "properties": {
    "$schema": {
      "type": "string",
      "description": "Schema URL for validation"
    },
    "version": {
      "type": "string",
      "pattern": "^\\d+\\.\\d+\\.\\d+$",
      "description": "Semantic version of this garden.json file"
    },
    "core": {
      "$ref": "slices/core.schema.json",
      "description": "Core garden identity and metadata (required)"
    },
    "sprouts": {
      "$ref": "slices/sprouts.schema.json",
      "description": "Products and services in the garden"
    },
    "maintainers": {
      "$ref": "slices/maintainers.schema.json",
      "description": "People who maintain the garden"
    },
    "theme": {
      "$ref": "slices/theme.schema.json",
      "description": "Visual theming for garden rendering"
    },
    "composition": {
      "$ref": "slices/composition.schema.json",
      "description": "Garden hierarchy (subgardens, supergardens)"
    }
  },
  "required": ["version", "core"],
  "additionalProperties": false
}
